Name,Rating,Address,Categories,Latitude,Longitude,Price,Reviews
Mixto Latin Cuisine,4.7,"3914 Judah St, San Francisco, CA 94122","Peruvian, Latin American, Breakfast & Brunch",37.76068,-122.50408,Not Available,"My brother & I took our family here for my mom's birthday. We wanted to try something that wasn't Asian food, so we picked Peruvian food. We ordered a bunch...
Wonderful neighborhood restaurant! Feb Saturday night looking for less typical fare and was surprised to see Peruvian so close in the neighborhood!
Staff...
We found Mixto by happenchance and happy we did! We came when it was cold and rainy and this meal was SO comforting! Everything was really flavorful and the..."
Gaspare's Pizza House & Italian Restaurant,3.9,"5546 Geary Blvd, San Francisco, CA 94121","Italian, Pizza",37.780586,-122.479153,$$,"Where do I even begin? Gaspare's has been a family favorite for pizza for over 20 years. We don't get to have Gaspare's often as we don't live in SF...
It's been ages since I last came here. Back then, it used to be Vince's Pizzaria. Surprisingly, the decor hasn't changed a bit--those plastic grapevines...
Every year we come here for my best friend's birthday and I can't believe it tastes better every time! The service is impeccable, fast, friendly, kind! They..."
Hummus Bodega,4.6,"5549 Geary Blvd, San Francisco, CA 94121",Mediterranean,37.780147,-122.479202,$$,"Excellent food, especially for vegans and those who appreciate Mediterranean and Middle East style foods 

Made with care !
Woooooooow!!!! I'm super impressed. I've been eyeing this place over the past year and I'm so glad I finally got to try it out for my birthday. This had to...
The only kosher restaurant in San Francisco. 
The service is great, and food is even more! 
We order  shnizel in plate and hummus with falafel. All food..."
Top SF BBQ,3.6,"2311 Clement St, San Francisco, CA 94121","Barbeque, Chinese",37.78194,-122.48409,$$,"I changed my mind about this place. I just recently moved to a neighborhood that's right by this place so I started getting more deliveries from them...
A tasty spot for Chinese bbq that fills its niche well. They stick to traditional Chinese spices such as mala and cumin-heavy seasoning, so your dining...
Very good Chinese Barbecue, and also maybe the best Asian noodles I have ever had.  They may not be the Chinese place you go for a cheap meal on a routine..."
Noodle in a Haystack,4.8,"4601 Geary Blvd, San Francisco, CA 94118","Ramen, New American",37.78066412799114,-122.46872181182351,$$$$,"Dinner review. Japanese (non-traditional) tasting menu. 

(Menu from website below is close to what we had but not exactly.)

Sake Pairing
​
(Highlight)...
Is Ramen  worth $200? 1000% yes! You can taste amount of passion and love that Chef Clint and Chef Yoko poured in within your palette . I have waited at...
Review for my visit back in June 2023:

Noodle in a Haystack has the hardest to get reservation in the city for good reason. You can feel Clint and Yoko's..."
Kothai Republic,4.6,"1398 9th Ave, San Francisco, CA 94122","Korean, Thai, Breakfast & Brunch",37.762389,-122.466065,Not Available,"I stumbled upon this place while it was raining unprepared for an incredible meal.

We got the shrooms starter and it was amazing. But what stood out was...
Dining out in SF has been financially stressful such as paying those 'SF health mandates fee,' '20% and up suggested tips,' 'fixed surcharges,' '$2 and up...
Came to Kothai with a friend after touting its unique menu and much to my surprise, it now features many more standard American fares! A couple features had..."
